### ISSUE TITLE
Cannot visit some http1.1 website under caddy+forwardproxy setup

### ISSUE THREAD

**Issue by Chilledheart** [klzgrad/naiveproxy#537]
I was using naiveproxy to visit some server website which have some server settings, such as:
- http://www.haproxy.org/download/1.9/doc/proxy-protocol.txt

I got a 403 error. Without the proxy, it returned OK. Call curl directly from the serer, it returned OK.

Checked with naiveproxy client:
```
[0719/145422.464929:WARNING:http_proxy_socket.cc(352)] GET http://www.haproxy.org/download/1.9/doc/proxy-protocol.txt HTTP/1.1
Host: www.haproxy.org
Cache-Control: max-age=0
Upgrade-Insecure-Requests: 1
User-Agent: Mozilla/5.0 (X11; Linux x86_64) AppleWebKit/537.36 (KHTML, like Gecko) Chrome/114.0.0.0 Safari/537.36
Accept: text/html,application/xhtml+xml,application/xml;q=0.9,image/avif,image/webp,image/apng,*/*;q=0.8,application/signed-exchange;v=b3;q=0.7
Accept-Encoding: gzip, deflate
Accept-Language: en-US,en;q=0.9
Cookie: served=1:TCP:IPv6; served=1:TCP:IPv6
```

Checked with the server (with tcpdump):
```
07:57:33.793805 IP6 (flowlabel 0x8698c, hlim 64, next-header TCP (6) payload length: 561) epic-one.34614 > 2001:bc8:35ee:100::1.http: Flags [P.], cksum 0x4c27 (incorrect -> 0xd19a), seq 1:530, ack 1, win 43, options [nop,nop,TS val 4289579088 ecr 204303789], length 529: HTTP, length: 529
        GET http://www.haproxy.org/download/1.9/doc/proxy-protocol.txt HTTP/1.1
        Host: www.haproxy.org
        Cache-Control: max-age=0
        Upgrade-Insecure-Requests: 1
        User-Agent: Mozilla/5.0 (X11; Linux x86_64) AppleWebKit/537.36 (KHTML, like Gecko) Chrome/114.0.0.0 Safari/537.36
        Accept: text/html,application/xhtml+xml,application/xml;q=0.9,image/avif,image/webp,image/apng,*/*;q=0.8,application/signed-exchange;v=b3;q=0.7
        Accept-Encoding: gzip, deflate
        Accept-Language: en-US,en;q=0.9
        Cookie: served=1:TCP:IPv6; served=1:TCP:IPv6



`.i..1.@ .......T....... ...5............6.P+.r.nU(....+L'.....
...P.-m.GET http://www.haproxy.org/download/1.9/doc/proxy-protocol.txt HTTP/1.1
Host: www.haproxy.org
Cache-Control: max-age=0
Upgrade-Insecure-Requests: 1
User-Agent: Mozilla/5.0 (X11; Linux x86_64) AppleWebKit/537.36 (KHTML, like Gecko) Chrome/114.0.0.0 Safari/537.36
Accept: text/html,application/xhtml+xml,application/xml;q=0.9,image/avif,image/webp,image/apng,*/*;q=0.8,application/signed-exchange;v=b3;q=0.7
Accept-Encoding: gzip, deflate
Accept-Language: en-US,en;q=0.9
Cookie: served=1:TCP:IPv6; served=1:TCP:IPv6




07:57:33.948309 IP6 (hlim 54, next-header TCP (6) payload length: 252) 2001:bc8:35ee:100::1.http > epic-one.34614: Flags [P.], cksum 0x205f (correct), seq 1:221, ack 530, win 232, options [nop,nop,TS val 204303944 ecr 4289579088], length 220: HTTP, length: 220
        HTTP/1.1 403 Forbidden
        content-length: 93
        cache-control: no-cache
        content-type: text/html
        set-cookie: served=1:TCP:IPv6

        <html><body><h1>403 Forbidden</h1>
        Request forbidden by administrative rules.
        </body></html>
`......6 ...5........... .......T........P.6nU(.+.u..... _.....
.-nH...PHTTP/1.1 403 Forbidden
content-length: 93
cache-control: no-cache
content-type: text/html
set-cookie: served=1:TCP:IPv6

<html><body><h1>403 Forbidden</h1>
Request forbidden by administrative rules.
</body></html>

07:57:33.948362 IP6 (flowlabel 0x8698c, hlim 64, next-header TCP (6) payload length: 32) epic-one.34614 > 2001:bc8:35ee:100::1.http: Flags [.], cksum 0x4a16 (incorrect -> 0x2963), ack 221, win 43, options [nop,nop,TS val 4289579242 ecr 204303944], length 0
`.i.. .@ .......T....... ...5............6.P+.u.nU)....+J......
.....-nH
07:57:34.731645 IP6 (flowlabel 0x8698c, hlim 64, next-header TCP (6) payload length: 486) epic-one.34614 > 2001:bc8:35ee:100::1.http: Flags [P.], cksum 0x4bdc (incorrect -> 0x8f61), seq 530:984, ack 221, win 43, options [nop,nop,TS val 4289580026 ecr 204303944], length 454: HTTP, length: 454
        GET http://www.haproxy.org/favicon.ico HTTP/1.1
        Host: www.haproxy.org
        Proxy-Connection: keep-alive
        User-Agent: Mozilla/5.0 (X11; Linux x86_64) AppleWebKit/537.36 (KHTML, like Gecko) Chrome/114.0.0.0 Safari/537.36
        Accept: image/avif,image/webp,image/apng,image/svg+xml,image/*,*/*;q=0.8
        Referer: http://www.haproxy.org/download/1.9/doc/proxy-protocol.txt
        Accept-Encoding: gzip, deflate
        Accept-Language: en-US,en;q=0.9
        Cookie: served=1:TCP:IPv6

`.i....@ .......T....... ...5............6.P+.u.nU)....+K......
.....-nHGET http://www.haproxy.org/favicon.ico HTTP/1.1
Host: www.haproxy.org
Proxy-Connection: keep-alive
User-Agent: Mozilla/5.0 (X11; Linux x86_64) AppleWebKit/537.36 (KHTML, like Gecko) Chrome/114.0.0.0 Safari/537.36
Accept: image/avif,image/webp,image/apng,image/svg+xml,image/*,*/*;q=0.8
Referer: http://www.haproxy.org/download/1.9/doc/proxy-protocol.txt
Accept-Encoding: gzip, deflate
Accept-Language: en-US,en;q=0.9
Cookie: served=1:TCP:IPv6


07:57:34.886416 IP6 (hlim 54, next-header TCP (6) payload length: 252) 2001:bc8:35ee:100::1.http > epic-one.34614: Flags [P.], cksum 0x1661 (correct), seq 221:441, ack 984, win 240, options [nop,nop,TS val 204304882 ecr 4289580026], length 220: HTTP, length: 220
        HTTP/1.1 403 Forbidden
        content-length: 93
        cache-control: no-cache
        content-type: text/html
        set-cookie: served=1:TCP:IPv6

        <html><body><h1>403 Forbidden</h1>
        Request forbidden by administrative rules.
        </body></html>
`......6 ...5........... .......T........P.6nU).+.v......a.....
.-q.....HTTP/1.1 403 Forbidden
content-length: 93
cache-control: no-cache
content-type: text/html
set-cookie: served=1:TCP:IPv6

<html><body><h1>403 Forbidden</h1>
Request forbidden by administrative rules.
</body></html>

```

<del>The naiveproxy had removed the header such as `Proxy-Connection` but the server (caddy+forwardproxy) added it again. I checked with forwardproxy code, it should be removed by design. </del>
I don't know how it happened,  the request is correct except for Referer request. So, still investigating.

caddy version:
```
v2.6.4 h1:2hwYqiRwk1tf3VruhMpLcYTg+11fCdr8S3jhNAdnPy8=
```
naiveproxy version:
```
naive 114.0.5735.91
```

**Comment by Chilledheart** [comment]
https://github.com/klzgrad/forwardproxy/blob/ef4a5997791af459e80d166ea4a58f83db4309c2/forwardproxy.go#L741-L761

**Comment by klzgrad** [comment]
Root cause similar to https://github.com/http-party/node-http-proxy/issues/529

**Comment by Chilledheart** [comment]
nice catch, I can verify the below primitive patch works for this url
```
    auto absolute_prefix = buffer_.find("://", first_space + 1);
    if (absolute_prefix == std::string::npos) {
      ss << buffer_.substr(0, first_line_end) << "\r\n";
    } else {
      auto uri_start = buffer_.find('/', absolute_prefix + 3);
      ss << buffer_.substr(0, first_space) << " " << buffer_.substr(uri_start);
    }
```

**Comment by klzgrad** [comment]
I use GURL to parse the request URI. See if you can review the following:

https://github.com/klzgrad/naiveproxy/blob/c942f02b7cf2d8c9411fb052343adeba16dc3d89/src/net/tools/naive/http_proxy_server_socket.cc#L325-L429

**Comment by Chilledheart** [comment]
> 

yeah, better.

**Comment by Chilledheart** [comment]
https://github.com/klzgrad/naiveproxy/blob/c942f02b7cf2d8c9411fb052343adeba16dc3d89/src/net/tools/naive/http_proxy_server_socket.cc#L391C1-L395C6

I am not so sure, but what if path component could be empty in absoluteURI? what about:

```
    uri = url.has_path() ? url.path() : "/";
    if (url.has_query()) {
      uri.append("?").append(url.query());
    }
```

**Comment by Chilledheart** [comment]
I cannot figure out what's the meaning by the comment of GURL:
```
  // Path, this is everything following the host name, stopping at the query of
  // ref delimiter (if any). Length will be -1 if unspecified. This includes
  // the preceeding slash, so the path on http://www.google.com/asdf" is
  // "/asdf". As a result, it is impossible to have a 0 length path, it will
  // be -1 in cases like "http://host?foo".
  // Note that we treat backslashes the same as slashes.
```

**Comment by klzgrad** [comment]
https://source.chromium.org/chromium/chromium/src/+/main:url/gurl_unittest.cc;drc=8e7903206f9a08432d752a0b49a0b2e65aa672e7;l=252

**Comment by klzgrad** [comment]
https://github.com/klzgrad/naiveproxy/releases/tag/v115.0.5790.166-1
