### ISSUE TITLE
Cannot connect to some sites via Naiveproxy  

### ISSUE THREAD

**Issue by gili-gili** [klzgrad/naiveproxy#576]
Cannot connect to some sites via Naiveproxy with latest version of client  
I'm sure they are accessible from the host machine  

Tested not working:
```text
https://google.com.tw/
https://whatismyipaddress.com
https://bing.com/
https://yandex.com/
https://cloudflare.com/
```

Tested working:
```text
https://duckduckgo.com/
https://github.com/ (some assets failed to load)
https://www.reddit.com/ (some assets failed to load)
https://www.paypal.com/
```

I didn't see any error logs from both client side and server side, just `Connection xxx to xxx` and `Connection xxx closed: OK`

## Config
```json
  "routes": [
    {
      "handle": [
        {
          "handler": "subroute",
          "routes": [
            {
              "handle": [
                {
                  "auth_user_deprecated": "user1",
                  "auth_pass_deprecated": "passwd1",
                  "handler": "forward_proxy",
                  "hide_ip": true,
                  "hide_via": true,
                  "probe_resistance": {}
                },
                {
                  "auth_user_deprecated": "user2",
                  "auth_pass_deprecated": "passwd2",
                  "handler": "forward_proxy",
                  "hide_ip": true,
                  "hide_via": true,
                  "probe_resistance": {}
                }
              ]
            }
          ]
        }
      ]
    }
  ]
```

**Comment by gili-gili** [comment]
Tried other anti-censorship tools and they works just as expected

**Comment by klzgrad** [comment]
Use tcpdump on the server to test if Caddy has issue connecting to the sites you mentioned.

**Comment by gili-gili** [comment]
Sir can you be a little more specific? I'm a linux newbie and I don't know how to use command correctly. Do you need me to capture traffic from host to the target site? If so, here is the output
```
$ sudo tcpdump -i eth0 dst host wikipedia.org # wrong command?
tcpdump: verbose output suppressed, use -v[v]... for full protocol decode
listening on eth0, link-type EN10MB (Ethernet), snapshot length 262144 bytes
20:26:45.417582 IP6 HOST.42964 > text-lb.ulsfo.wikimedia.org.https: Flags [S], seq 2682637068, win 64800, options [mss 1440,sackOK,TS val 3197922174 ecr 0,nop,wscale 7], length 0
20:26:46.243538 IP6 HOST.47304 > text-lb.ulsfo.wikimedia.org.https: Flags [S], seq 2423292835, win 64800, options [mss 1440,sackOK,TS val 3197923000 ecr 0,nop,wscale 7], length 0
20:26:47.273420 IP6 HOST.47304 > text-lb.ulsfo.wikimedia.org.https: Flags [S], seq 2423292835, win 64800, options [mss 1440,sackOK,TS val 3197924030 ecr 0,nop,wscale 7], length 0
20:26:48.489444 IP6 HOST.35282 > text-lb.ulsfo.wikimedia.org.https: Flags [S], seq 122725480, win 64800, options [mss 1440,sackOK,TS val 3197925246 ecr 0,nop,wscale 7], length 0
20:27:00.116805 IP HOST.49016 > text-lb.ulsfo.wikimedia.org.https: Flags [S], seq 2191601603, win 64240, options [mss 1460,sackOK,TS val 3701093180 ecr 0,nop,wscale 7], length 0
20:27:00.127778 IP HOST.49016 > text-lb.ulsfo.wikimedia.org.https: Flags [.], ack 1452232378, win 502, options [nop,nop,TS val 3701093191 ecr 1446525868], length 0
20:27:00.127971 IP HOST.49016 > text-lb.ulsfo.wikimedia.org.https: Flags [P.], seq 0:565, ack 1, win 502, options [nop,nop,TS val 3701093191 ecr 1446525868], length 565
20:27:00.128014 IP HOST.49016 > text-lb.ulsfo.wikimedia.org.https: Flags [F.], seq 565, ack 1, win 502, options [nop,nop,TS val 3701093191 ecr 1446525868], length 0
20:27:00.139810 IP HOST.49016 > text-lb.ulsfo.wikimedia.org.https: Flags [.], ack 2897, win 493, options [nop,nop,TS val 3701093203 ecr 1446525880], length 0
20:27:00.139885 IP HOST.49016 > text-lb.ulsfo.wikimedia.org.https: Flags [.], ack 4097, win 487, options [nop,nop,TS val 3701093203 ecr 1446525880], length 0
20:27:00.139937 IP HOST.49016 > text-lb.ulsfo.wikimedia.org.https: Flags [.], ack 5377, win 481, options [nop,nop,TS val 3701093203 ecr 1446525881], length 0
20:27:00.139985 IP HOST.49016 > text-lb.ulsfo.wikimedia.org.https: Flags [.], ack 5378, win 481, options [nop,nop,TS val 3701093203 ecr 1446525881], length 0
20:27:03.129991 IP HOST.43244 > text-lb.ulsfo.wikimedia.org.https: Flags [S], seq 2948255775, win 64240, options [mss 1460,sackOK,TS val 3701096193 ecr 0,nop,wscale 7], length 0
20:27:03.141710 IP HOST.43244 > text-lb.ulsfo.wikimedia.org.https: Flags [.], ack 531881206, win 502, options [nop,nop,TS val 3701096205 ecr 1446528882], length 0
20:27:03.141983 IP HOST.43244 > text-lb.ulsfo.wikimedia.org.https: Flags [P.], seq 0:565, ack 1, win 502, options [nop,nop,TS val 3701096205 ecr 1446528882], length 565
20:27:03.142019 IP HOST.43244 > text-lb.ulsfo.wikimedia.org.https: Flags [F.], seq 565, ack 1, win 502, options [nop,nop,TS val 3701096205 ecr 1446528882], length 0
20:27:03.153758 IP HOST.43244 > text-lb.ulsfo.wikimedia.org.https: Flags [.], ack 2897, win 495, options [nop,nop,TS val 3701096217 ecr 1446528894], length 0
20:27:03.153805 IP HOST.43244 > text-lb.ulsfo.wikimedia.org.https: Flags [.], ack 4097, win 489, options [nop,nop,TS val 3701096217 ecr 1446528894], length 0
20:27:03.153840 IP HOST.43244 > text-lb.ulsfo.wikimedia.org.https: Flags [.], ack 5377, win 483, options [nop,nop,TS val 3701096217 ecr 1446528894], length 0
20:27:03.153847 IP HOST.43244 > text-lb.ulsfo.wikimedia.org.https: Flags [.], ack 5378, win 483, options [nop,nop,TS val 3701096217 ecr 1446528894], length 0
```

**Comment by gili-gili** [comment]
I think I should solve this puzzle by myself......
